stage_id,decision,expected_decision,ready,purpose
stage154,SIMULATED_NOISE_TARGETED_HARDWARE_FOLLOWUP_RECOMMENDED,SIMULATED_NOISE_TARGETED_HARDWARE_FOLLOWUP_RECOMMENDED,True,simulated-only screen recommends targeted hardware follow-up
stage157,FIRST_PROVIDER_LIVE_RUN_APPROVAL_PACKET_READY,FIRST_PROVIDER_LIVE_RUN_APPROVAL_PACKET_READY,True,approval packet is ready and still requires the exact approval phrase
stage159,FIRST_PROVIDER_BACKEND_PREFLIGHT_READY_AWAITING_APPROVAL,FIRST_PROVIDER_BACKEND_PREFLIGHT_READY_AWAITING_APPROVAL,True,configured IBM backend resolved in a read-only preflight
stage160,FIRST_PROVIDER_POST_RUN_ANALYSIS_PACKET_READY_AWAITING_PROVIDER_RESULTS,FIRST_PROVIDER_POST_RUN_ANALYSIS_PACKET_READY_AWAITING_PROVIDER_RESULTS,True,post-result no-submit analysis sequence is prepared
stage161,FIRST_PROVIDER_EXPOSURE_PACKET_READY_AWAITING_APPROVAL,FIRST_PROVIDER_EXPOSURE_PACKET_READY_AWAITING_APPROVAL,True,job and shot exposure is quantified before approval
